{
  "id": "pi3aplus",
  "model": "Raspberry Pi 3 Model A+",
  "coordinates": "mm, board seen from the top as on the drawing. x runs along the long edge from the microSD end; y runs from the near edge (micro USB, HDMI, audio), which faces the lid hinge. z is height above the top surface of the PCB.",
  "source": {
    "url": "https://pip.raspberrypi.com/documents/RP-008330-DS",
    "sha256": "3a57851b81c319005ed04ef3bd303a66857cee65226e54d9f89a73f60d141923"
  },
  "board": {
    "length": {"value": 65, "source": "drawing: overall 65", "verified": true},
    "width": {"value": 56, "source": "drawing: overall 56", "verified": true},
    "thickness": {"value": 1.6, "source": "not on the drawing; standard 1.6 mm PCB assumed, measure yours", "verified": false},
    "corner_radius": {"value": 3.0, "source": "drawing: CORNER RADIUS 3MM", "verified": true}
  },
  "holes": {
    "diameter": 2.5,
    "positions": [[3.5, 3.5], [61.5, 3.5], [3.5, 52.5], [61.5, 52.5]],
    "source": "drawing: 3.5 from the edges; diameter measured from vectors (drawn 2.47)",
    "verified": true
  },
  "height_above": {"value": 8.5, "source": "drawing: GPIO header Z-Height=8.5 (tallest)", "verified": true},
  "depth_below": {"value": 3.0, "source": "not on the drawing; microSD socket with card and through-hole pins estimated at 3 mm below the PCB", "verified": false},
  "ports": [
    {"id": "power", "label": "POWER", "edge": "near", "from": 6.58, "to": 14.61, "z_min": 0, "z_max": 3.0, "overhang": 1.2,
     "source": "drawing: micro USB centre 10.6, outline from vectors. Height not on the drawing; 3.0 mm assumed", "verified": false},
    {"id": "hdmi", "label": "HDMI", "edge": "near", "from": 24.74, "to": 39.24, "z_min": 0, "z_max": 6.5, "overhang": 1.49,
     "source": "drawing: HDMI centre 32, Z-Height=6.5; outline from vectors", "verified": true},
    {"id": "audio", "label": "AUDIO", "edge": "near", "from": 50.5, "to": 56.49, "z_min": 0, "z_max": 6.0, "overhang": 2.49,
     "source": "drawing: audio jack centre 53.5, Z-Height=6; outline from vectors", "verified": true},
    {"id": "usb", "label": "USB", "edge": "right", "from": 24.15, "to": 38.09, "z_min": 0, "z_max": 7.0, "overhang": 2.51,
     "source": "drawing: USB centre 31.5, Z-Height=7.0; outline from vectors", "verified": true},
    {"id": "microsd", "label": "microSD", "edge": "left", "from": 22.5, "to": 33.5, "z_min": -3.0, "z_max": -1.6, "overhang": 2.5,
     "protrudes_through": true,
     "source": "not on the drawing (underside). 11 mm card assumed centred 28 mm from the near edge, under the PCB, sticking out about 2.5 mm when inserted",
     "verified": false}
  ],
  "notes": [
    "The far edge (GPIO header) has no ports, so the lid's tuck flap goes inside the far wall.",
    "Camera and display ribbon connectors are not given openings; route ribbons out under the lid.",
    "The Raspberry Pi docs say this drawing also applies to the original Model A+."
  ]
}
